id,title,authors,publication_year,journal,doi,relevance_score
https://openalex.org/W2106848990,Space environment and evaluation for RASAT,"Murat Hüdaverdi, Ilknur Baylakoglu",2011,,https://doi.org/10.1109/rast.2011.5966978,2.5584297
https://openalex.org/W2940199079,Research on autocorrelation and cross-correlation analyses in vehicular nodes positioning,"Xuerong Cui, Jingzhen Li, Juan Li, Jianhang Liu, Tingpei Huang, Haihua Chen",2019,,https://doi.org/10.1177/1550147719843864,2.5542014
https://openalex.org/W1747117966,A spacecraft fiber optic data system-radiation effects,Kenneth A. LaBel,2002,,https://doi.org/10.1109/radecs.1991.213563,2.550633
https://openalex.org/W3207735428,Parker Solar Probe detects solar radio bursts related with a behind–the–limb active region,"A. A. Stanislavsky, I. N. Bubnov, A. Koval, S. N. Yerin",2021,,https://doi.org/10.1051/0004-6361/202141984,2.547952
https://openalex.org/W1964452706,National Response to a Severe Space Weather Event,Ronald E. Turner,2012,,https://doi.org/10.1029/2011sw000756,2.5464697
https://openalex.org/W2142160069,Mitigation of anomalous ionosphere threat to enhance utility of LAAS Differentially Corrected Positioning Service (DCPS),"Young S. Park, Sam Pullen, Per Enge",2008,,https://doi.org/10.1109/plans.2008.4570017,2.5440521
https://openalex.org/W2033742819,SET and SEU simulation toolkit for LabVIEW,"Walter Calienes Bartra, Ricardo Reis",2011,,https://doi.org/10.1109/radecs.2011.6131342,2.5401235
https://openalex.org/W2893879090,Extreme Space Weather Events and Military Operations,M. Messerotti,2018,,https://doi.org/10.23919/ursi-at-rasc.2018.8471312,2.5335424
https://openalex.org/W3155037853,Nanosatellites,A. Gruppuso,2020,,https://doi.org/10.1002/9781119042044,2.531835
https://openalex.org/W2088172136,Temporal scaling of volcanic eruptions,"L. Sanchez, R. Shcherbakov",2012,,https://doi.org/10.1016/j.jvolgeores.2012.08.004,2.5308893
https://openalex.org/W1966714765,Release timescales of solar energetic particles in the low corona,"N. Agueda, Karl-Ludwig Klein, Nicole Vilmer, R. Rodríguez-Gasén, O. Malandraki, Athanasios Papaioannou, M. Subirà, B. Sanahuja, Э. Валтонен, W. Dröge, A. Nindos, B. Heber, Stephan Braune, Ilya Usoskin, Patrick Kilian, Eyob Talew, Rami Vainio",2014,,https://doi.org/10.1051/0004-6361/201423549,2.5306766
https://openalex.org/W4313641483,"Interrogating solar flare loop models with IRIS observations 2: Plasma properties, energy transport, and future directions",Graham S. Kerr,2023,,https://doi.org/10.3389/fspas.2022.1060862,2.5291722
https://openalex.org/W2314493717,A Review of Double Layer Simulations,Robert A. Smith,1982,,https://doi.org/10.1088/0031-8949/1982/t2a/031,2.5291042
https://openalex.org/W2318894461,The Human Research Program,"David L. Tomko, Kathy Laurini, Marsha Nall",2007,,https://doi.org/10.2514/6.2007-138,2.5282023
https://openalex.org/W327749744,An Approach to Prognostic Decision Making in the Aerospace Domain,"Edward Balaban, Juan J. Alonso",2012,,https://doi.org/10.36001/phmconf.2012.v4i1.2098,2.5273833
https://openalex.org/W2280565304,Services for GNSS users within the ESA Space Situational Awareness Space Weather Service Network,"M. Kruglanski, Erwin De Donder, Alexi Glover, Claudia Borries, Jan Janssens",2015,,https://doi.org/10.1109/iain.2015.7352229,2.5263774
https://openalex.org/W2062324710,A new low-background Compton telescope using LaBr 3 scintillator,"Peter F. Bloser, J. M. Ryan, Jason Legere, Manuel Julien, Christopher M. Bancroft, M. McConnell, Mark S. Wallace, R. M. Kippen, Shawn Tornga",2009,,https://doi.org/10.1117/12.826191,2.5260243
https://openalex.org/W1641935945,Schottky Barrier CdTe(Cl) Detectors for Planetary Missions,Y. Eisen,2002,,https://doi.org/10.1063/1.1513963,2.5255435
https://openalex.org/W2080722852,Optimization of CubeSat System-Level Design and Propulsion Systems for Earth-Escape Missions,"Sara Spangelo, Benjamin Longmier",2015,,https://doi.org/10.2514/1.a33136,2.525319
https://openalex.org/W1980844388,A new differential positioning method using modulation correlation of signals of opportunity,"Toby A Webb, Paul D. Groves, Paul Cross, Robert Mason, J.H. Harrison",2010,,https://doi.org/10.1109/plans.2010.5507270,2.523149
https://openalex.org/W2022143881,Measurement of Spectral Transmittance and Reflectance with a Far Infrared Michelson Interferometer,E. E. Bell,1964,,https://doi.org/10.7567/jjaps.1s1.412,2.522353
https://openalex.org/W2883000460,Sandpile Models and Solar Flares: Eigenfunction Decomposition for Data Assimilation,"Antoine Strugarek, A. S. Brun, Paul Charbonneau, Nicole Vilmer",2017,,https://doi.org/10.1017/s1743921317007244,2.5200164
https://openalex.org/W4224276018,Detection of Solar Flares from the Analysis of Signal-to-Noise Ratio Recorded by Digisonde at Mid-Latitudes,"V. de Paula, Antoni Segarra, David Altadill, J. J. Curto, Estefanía Blanch",2022,,https://doi.org/10.3390/rs14081898,2.519204
https://openalex.org/W2766392325,Unaddressed threat to power grid infrastructure: Electromagnetic pulse,"Abhishek Chauhan, Surya Prakash",2016,,https://doi.org/10.1109/iicpe.2016.8079355,2.5183918
https://openalex.org/W2069748683,Overview of the effects of solar-terrestrial phenomena on man and his environment,"M. A. Shea, D. F. Smart",1996,,https://doi.org/10.1007/bf02508135,2.5180907
https://openalex.org/W4323315800,Evolution of coronal magnetic field parameters during X5.4 solar flare,"Seth H. Garland, Vasyl Yurchyshyn, Robert Loper, Benjamin F. Akers, Daniel J. Emmons",2023,,https://doi.org/10.3389/fspas.2023.1148293,2.5115151
https://openalex.org/W2793906347,NIST-Traceable Neutron Dosimetry Is Needed for Air Travel Radiation Safety,E.T. Bramlitt,2018,,https://doi.org/10.1097/hp.0000000000000829,2.5111713
https://openalex.org/W2015803353,Test alert service against very large SEP Events,"N. Gevorgyan, V. Kh. Babayan, A. Chilingarian, Hamlet Martirosyan",2005,,https://doi.org/10.1016/j.asr.2004.04.016,2.506473
https://openalex.org/W4387430300,Explainable Deep Learning-Based Solar Flare Prediction with Post Hoc Attention for Operational Forecasting,"Chetraj Pandey, Rafal A. Angryk, Manolis K. Georgoulis, Berkay Aydin",2023,,https://doi.org/10.1007/978-3-031-45275-8_38,2.5054615
https://openalex.org/W4285120846,A Comprehensive Review on Small Satellite Microgrids,"Mohammad Yaqoob, Abderezak Lashab, Juan C. Vásquez, Josep M. Guerrero, Marcos E. Orchard, Angelina D. Bintoudi",2022,,https://doi.org/10.1109/tpel.2022.3175093,2.5039082
https://openalex.org/W1506330,Introduction to machine-to-machine (M2M) communications,"Carles Antón‐Haro, Mischa Döhler",2015,,https://doi.org/10.1016/b978-1-78242-102-3.00001-0,2.5035043
https://openalex.org/W2062038493,<title>X-ray imaging and spectroscopic performance of the JET-X telescope on the Spectrum X-Gamma</title>,"A. A. Wells, Alan Owens, M. R. Sims",1994,,https://doi.org/10.1117/12.193166,2.4977133
https://openalex.org/W3199307709,Risk assessment of a solar attack according to ISO 31000 standard,"Igor Lavrnić, Ana Bašić, Dejan Viduka",2021,,https://doi.org/10.30765/er.1566,2.4969654
https://openalex.org/W2707710552,MINERALOGY OF PRESOLAR SILICATE AND OXIDE GRAINS OF DIVERSE STELLAR ORIGINS,"A. N. Nguyen, L. P. Keller, S. Messenger",2016,,https://doi.org/10.3847/0004-637x/818/1/51,2.4957743
https://openalex.org/W4367857338,Detection and Characterization of a Coronal Mass Ejection Using Interplanetary Scintillation Measurements From the Murchison Widefield Array,"John Morgan, Patrick McCauley, A. Waszewski, R. D. Ekers, Rajan Chhetri",2023,,https://doi.org/10.1029/2022sw003396,2.4948034
https://openalex.org/W2047071102,The Advanced Technology Solar Telescope: design and early construction,"J. P. McMullin, Thomas Rimmelé, S. L. Keil, M. Warner, Samuel C. Barden, Scott E. Bulau, Simon C. Craig, Bret Goodrich, Eric R. Hansen, S. Hegwer, Robert P. Hubbard, William R. McBride, Steve Shimko, Friedrich Wöger, J. Ditsler",2012,,https://doi.org/10.1117/12.926949,2.4921904
https://openalex.org/W2080575284,Loss of equilibrium and reconnection in tearing of two-dimensional equilibria,"John M. Finn, P. N. Guzdar",1993,,https://doi.org/10.1063/1.860674,2.4898446
https://openalex.org/W2153994860,The science case for the EISCAT_3D radar,"I. W. McCrea, Anita Aikio, Lucilla Alfonsi, Evgenia Belova, S. C. Buchert, Mark A. Clilverd, N. Engler, B. Gustavsson, C. J. Heinselman, Johan Kero, M. J. Kosch, H. Lamy, T. B. Leyser, Yasunobu Ogawa, K. Oksavik, Asta Pellinen‐Wannberg, F. Pitout, Markus Rapp, I. Stanisławska, Juha Vierinen",2015,,https://doi.org/10.1186/s40645-015-0051-8,2.4895566
https://openalex.org/W2559134451,The National Space Weather Program: Two decades of interagency partnership and accomplishments,"Michael F. Bonadonna, L. J. Lanzerotti, Judson E. Stailey",2017,,https://doi.org/10.1002/2016sw001523,2.4790688
https://openalex.org/W4223976806,The Origins of Long‐Term Variability in Martian Upper Atmospheric Densities,"Xiaohua Fang, J. M. Forbes, M. Benna, L. Montabone, S. Curry, B. M. Jakosky",2022,,https://doi.org/10.1029/2021ja030145,2.479022
https://openalex.org/W2754971321,CubeSat On-Orbit Temperature Comparison to Thermal-Balance-Tuned-Model Predictions,"James Mason, Bret Lamprecht, T. N. Woods, Chloe Downs",2018,,https://doi.org/10.2514/1.t5169,2.4741144
https://openalex.org/W97414083,Climate of the upper atmosphere,"J. Bremer, Jan Lasˇtovicˇka, A. A. Snesarev, David Altadill, P. Bencze, Dalia Buresˇová, Giorgiana De Franceschi, Christoph Jacobi, S. S. Kouris, Loredana Perrone, Esa Turunen",2009,,https://doi.org/10.4401/ag-4576,2.4725199
https://openalex.org/W2080814938,&lt;title&gt;Overview of photonic components for space applications: radiation and temperature responses&lt;/title&gt;,Edward W. Taylor,1993,,https://doi.org/10.1117/12.156583,2.4645412
https://openalex.org/W3104592981,Collisional and Radiative Processes in Optically Thin Plasmas,"S. J. Bradshaw, J. C. Raymond",2013,,https://doi.org/10.1007/s11214-013-9970-0,2.460146
https://openalex.org/W1576441082,Radiation effects in photonic technologies destined for space applications,"Edward W. Taylor, Roberta Ewart",1999,,https://doi.org/10.1063/1.57699,2.4598207
https://openalex.org/W1566759063,The effects of earthward directed interplanetary coronal mass ejections on near‐Earth S band signal links,"D. D. Morabito, O. P. Verkhoglyadova, Dongsuk Han, Joseph E. Riedel",2011,,https://doi.org/10.1029/2011rs004718,2.4569845
https://openalex.org/W2147360973,A reliable fault classifier for dependable systems on SRAM-based FPGAs,"Cristiana Bolchini, Chiara Sandionigi, L. Fossati, David Merodio Codinachs",2011,,https://doi.org/10.1109/iolts.2011.5993817,2.4558098
https://openalex.org/W4385899767,Statistical analysis of the onset temperature of solar flares in 2010–2011,"Douglas Félix da Silva, Hui Li, Paulo J. A. Simões, Adriana Válio, C. E. R. Joaquim, H. S. Hudson, L. Fletcher, L. Fletcher, Laura A. Hayes, I. G. Hannah",2023,,https://doi.org/10.1093/mnras/stad2244,2.4495313
https://openalex.org/W585970796,Low Power and Reliable SRAM Memory Cell and Array Design,"Koichiro Ishibashi, Kenichi Osada",2011,,https://doi.org/10.1007/978-3-642-19568-6,2.4492557
https://openalex.org/W4298382261,"Pescaroli, G; Green, LM; Wicks, RT; Turner, S; Bhattarai, S; (2019) Cascading effects of global positioning and navigation satellite service failures.",,2019,,https://doi.org/10.14324/000.rp.10076568,2.4446054
https://openalex.org/W1973585779,JUNO Photovoltaic Power at Jupiter,"Scott T. M. Dawson, P. M. Stella, William J. McAlpine, Brian Smith",2012,,https://doi.org/10.2514/6.2012-3833,2.4428735
https://openalex.org/W3119385233,A reliable ensemble based approach to semi-supervised learning,"Sjoerd de Vries, Dirk Thierens",2021,,https://doi.org/10.1016/j.knosys.2021.106738,2.4404042
https://openalex.org/W2948610157,Arctic 2.0: How Artificial Intelligence Can Help Develop a Frontier,"Patrick Lin, Fritz Allhoff",2019,,https://doi.org/10.1017/s0892679419000108,2.4398513
https://openalex.org/W2770079725,Single Event Effects Characterization of BAE Systems RADNET™ 1848-PS RapidIO® Packet Switch,"Ann E. Kelly, John Rodgers, Stephen Johnson, Ronald D. Brown, Aaron W. Adamson",2017,,https://doi.org/10.1109/nsrec.2017.8115484,2.4392295
https://openalex.org/W2008890442,Dynamic monitoring of coalbed methane reservoirs using Super-Low Frequency electromagnetic prospecting,"Nan Wang, Qiming Qin, Li Chen, Yanbing Bai, Shanshan Zhao, Chengye Zhang",2014,,https://doi.org/10.1016/j.coal.2014.03.002,2.4329944
https://openalex.org/W2073215872,Stability of the Infrared Array Camera for the Spitzer Space Telescope,"S. Carey, J. Surace, Mark Lacy, W. Glaccum, Patrick Lowrance, Joseph L. Hora, Steve Willner",2008,,https://doi.org/10.1117/12.790030,2.4326856
https://openalex.org/W1541975011,Correlation of GEO Comsat Anomalies and Space Weather Phenomena for Improved Satellite Performance and Risk Mitigation,"Whitney Lohmeyer, D. N. Baker",2012,,https://doi.org/10.2514/6.2012-15083,2.43122
https://openalex.org/W2027064962,Properties and Mechanics of the Lunar Regolith,"Stewart W. Johnson, Koon Meng Chua",1993,,https://doi.org/10.1115/1.3120358,2.430282
https://openalex.org/W1530475701,Hardware and software considerations for unmanned aircraft systems,Laurence H. Mutuel,2015,,https://doi.org/10.1109/icnsurv.2015.7121235,2.4227808
https://openalex.org/W2095566903,Photon time-interval statistics applied to the analysis of laser heterodyne signal with photon counter,"Lisheng Liu, Heyong Zhang, Jin Guo, Shuai Zhao, Tingfeng Wang",2012,,https://doi.org/10.1016/j.optcom.2012.05.019,2.4218304
https://openalex.org/W3154830282,A Spectral-Spatial Features Integrated Network for Hyperspectral Detection of Marine Oil Spill,"Bin Wang, Qifan Shao, Dongmei Song, Zhongwei Li, Yunhe Tang, Changlong Yang, Mingyue Wang",2021,,https://doi.org/10.3390/rs13081568,2.418421
https://openalex.org/W2004419014,Comparison of existing &amp; proposed SOI MOSFET device structures for minimizing total dose radiation damage,S. Parke,2004,,https://doi.org/10.1109/aero.2004.1368037,2.4176657
https://openalex.org/W2140205423,In-Flight Anomalies and Lessons Learned from the Mars Reconnaissance Orbiter Mission,Todd Bayer,2008,,https://doi.org/10.1109/aero.2008.4526483,2.4163306
https://openalex.org/W4221045383,Assessing the spectral characteristics of band splitting type II radio bursts observed by CALLISTO spectrometers,"F.N. Minta, Satoshi Nozawa, Kamen Kozarev, A. Elsaid, A. Mahrous",2023,,https://doi.org/10.1016/j.asr.2022.03.029,2.4150813
https://openalex.org/W2553370489,Total Ionizing Dose Effects on a 12-bit 40kS/s SAR ADC Designed With a Dummy Gate-Assisted n-MOSFET,"Tae Hyo Kim, Hee Chul Lee",2017,,https://doi.org/10.1109/tns.2016.2631723,2.4138746
https://openalex.org/W2155787527,"Proton-induced SEU, dose effects, and LEO performance predictions for R3000 microprocessors","D.L. Shaeffer, J. Kimbrough, J.W. Wilburn, S. Denton, J.L. Kaschmitter, N.J. Colella, Peter Coakley, C. Casteneda",1992,,https://doi.org/10.1109/23.211441,2.4105403
https://openalex.org/W2544631175,The service telemetry and control device for space experiment “GRIS”,A. S. Glyanenko,2016,,https://doi.org/10.1088/1742-6596/675/4/042041,2.4091313
https://openalex.org/W4307211179,Solar ring mission: Building a panorama of the Sun and inner-heliosphere,"Yuming Wang, Xianyong Bai, Changyong Chen, Linjie Chen, Xin Cheng, Lei Deng, Linhua Deng, Yuanyong Deng, Li Feng, Tingyu Gou, Jingnan Guo, Yang Guo, Xinjun Hao, Jiansen He, Junfeng Hou, Jiangjiang Huang, Zhenghua Huang, Haisheng Ji, Chaowei Jiang, Jie Jiang, Chunlan Jin, Xiaolei Li, Yiren Li, Jiajia Liu, Kai Liu, Liu Liu, Rui Liu, Rui Liu, Chengbo Qiu, Chenglong Shen, Fang Shen, Yuandeng Shen, X. J. Shi, Jiangtao Su, Yang Su, Yingna Su, Mingzhe Sun, Baolin Tan, Hui Tian, Li Wang, Lidong Xia, J. L. Xie, Ming Xiong, Mengjiao Xu, Xiaoli Yan, Yihua Yan, Shangbin Yang, Shuhong Yang, Shenyi Zhang, Quanhao Zhang, Yong Zhang, Jinsong Zhao, Guiping Zhou, Hong Zou",2023,,https://doi.org/10.1016/j.asr.2022.10.045,2.4075193
https://openalex.org/W2034762427,Reliability Limits of TMR Implemented in a SRAM-based FPGA: Heavy Ion Measures vs. Fault Injection Predictions,"G. Foucard, C. López-Ongil, Raoul Velazco",2011,,https://doi.org/10.1007/s10836-011-5245-4,2.4063804
https://openalex.org/W2999601655,Protein Backbone and Average Particle Dynamics in Reconstituted Discoidal and Spherical HDL Probed by Hydrogen Deuterium Exchange and Elastic Incoherent Neutron Scattering,"Valentin Gogonea, Judith Peters, Gary Gerstenecker, Celalettin Topbaş, Liming Hou, J. Combet, Joseph A. DiDonato, Jonathan D. Smith, Kerry‐Anne Rye, Stanley L. Hazen",2020,,https://doi.org/10.3390/biom10010121,2.4059687
https://openalex.org/W3123057636,"GRIPS - Gamma-Ray Imaging, Polarimetry and Spectroscopy","J. Greiner, M. Mariotti, F. Aharonian, M. Ajello, L. G. Balasz, G. Barbiellini, R. Bellazzini, S. Bishop, Gennady S. Bisnovatij-Kogan, Steven E. Boggs, Andrej Bykov, G. DiCocco, R. Diehl, D. Elsäesser, S. Foley, Claes Fransson, N. Gehrels, L. Hanlon, D. H. Hartmann, Wim Hermsen, W. Hillebrandt, R. Hudec, A. F. Iyudin, J. José, M. Kadler, G. Kanbach, W. Klamra, J. Kiener, S. Klose, I. Kreykenbohm, L. Kuiper, N. D. Kylafis, C. Labanti, K. Langanke, N. Langer, S. Larsson, B. Leibundgut, U. Laux, F. de Palma, Keiichi Maeda, R. Marcinkowski, M. Marisaldi, Brian McBreen, S. McBreen, A. Mészáros, K. Nomoto, M. Pearce, Asaf Pe’er, E. Pian, N. Prantzos, Georg G. Raffelt, O. Reimer, W. Rhode, Felix Ryde, Christian Schmidt, Joseph Silk, Б. М. Шустов, A. W. Strong, N. R. Tanvir, F.‐K. Thielemann, O. Tibolla, David L. Tierney, J. Trümper, Д. А. Варшалович, J. Wilms, G. Wrochna, A. A. Zdziarski, Andreas Zoglauer",2011,,https://doi.org/10.1007/s10686-011-9255-0,2.4024475
https://openalex.org/W767985155,An application of earthquake prediction algorithm M8 in eastern Anatolia at the approach of the 2011 Van earthquake,"Masoud Mojarab, V. G. Kossobokov, Hossein Memarian, Mehdi Zaré",2015,,https://doi.org/10.1007/s12040-015-0584-7,2.4007688
https://openalex.org/W2156827429,A checklist of what can zap your power electronics,A. Brockschmidt,2002,,https://doi.org/10.1109/apec.1998.647664,2.3981445
https://openalex.org/W1937308174,The European Ionosonde Service: nowcasting and forecasting ionospheric conditions over Europe for the ESA Space Situational Awareness services,"Anna Belehaki, Ioanna Tsagouri, I. Kutiev, Pencho Marinov, B. Zolesi, M. Pietrella, Kostas Themelis, Panagiotis Elias, K. Tziotziou",2015,,https://doi.org/10.1051/swsc/2015026,2.3935013
https://openalex.org/W2521859784,Ultra high molecular weight polyethylene (UHMWPE) fiber epoxy composite hybridized with Gadolinium and Boron nanoparticles for radiation shielding,"Venkat Mani, Narasimha S. Prasad, Ajit D. Kelkar",2016,,https://doi.org/10.1117/12.2240135,2.3910189
https://openalex.org/W3204242585,Four Global Catastrophic Risks – A Personal View,Russell Blong,2021,,https://doi.org/10.3389/feart.2021.740695,2.3909128
https://openalex.org/W4206108498,"Four New Horsemen of an Apocalypse? Solar Flares, Super-volcanoes, Pandemics, and Artificial Intelligence","Ilan Noy, Tomáš Uher",2022,,https://doi.org/10.1007/s41885-022-00105-x,2.3891675
https://openalex.org/W3098764632,Instrumental oscillations in RHESSI count rates during solar flares,"Andrew Inglis, I. V. Zimovets, B. R. Dennis, Eduard P. Kontar, V. M. Nakariakov, A. B. Struminsky, A. K. Tolbert",2011,,https://doi.org/10.1051/0004-6361/201016322,2.3887348
https://openalex.org/W1775023419,Solar Eruptions and Energetic Particles: An Introduction,"N. Gopalswamy, R. A. Mewaldt, J. Torsti",2006,,https://doi.org/10.1029/165gm02,2.3854365
https://openalex.org/W2065207989,Fault Resilient Real-Time Design for NoC Architectures,"Christopher Zimmer, Frank Mueller",2012,,https://doi.org/10.1109/iccps.2012.16,2.3835807
https://openalex.org/W2027573473,"Risks and threats to civilization, humankind, and the earth",Joseph F. Coates,2009,,https://doi.org/10.1016/j.futures.2009.07.010,2.3833463
https://openalex.org/W1126479232,Calibration of Hinode/XRT for Coalignment,"Keiji Yoshimura, D. E. McKenzie",2015,,https://doi.org/10.1007/s11207-015-0746-4,2.3800108
https://openalex.org/W2001243674,XEUS mission reference design,"Marcos Bavdaz, David H. Lumb, A. Peacock",2004,,https://doi.org/10.1117/12.552928,2.376333
https://openalex.org/W2169499137,CdTe focal plane detector for hard x-ray focusing optics,"P. Seller, Matthew D. Wilson, Matthew C. Veale, Andreas Schneider, Jessica A. Gaskin, C. Wilson‐Hodge, Steven Christe, Albert Y. Shih, Kyle Gregory, Andrew Inglis, Marco Panessa",2015,,https://doi.org/10.1117/12.2191617,2.3742585
https://openalex.org/W2072526501,Batse spectroscopy detector calibration,"D. L. Band, Linda Rosenman, J. L. Matteson, John Patrick Lestrade, B. J. Teegarden, Bradley E. Schaefer, T. L. Cline, Massimiliano Bonamente, W. S. Pačiesas, G. N. Pendleton, Robert Austin, G. J. Fishman, C. Meegan, Robert Wilson",1992,,https://doi.org/10.1007/bf00690088,2.3675897
https://openalex.org/W2045824551,"GNSS vulnerabilities: simulation, verification, and mitigation platform design","Xuezeng Zhao, Xingqun Zhan, Kai Yan",2013,,https://doi.org/10.1080/10095020.2013.817109,2.3638103
https://openalex.org/W3202578778,Earth-affecting solar transients: a review of progresses in solar cycle 24,"Jie Zhang, Manuela Temmer, N. Gopalswamy, O. Malandraki, N. Nitta, S. Patsourakos, Fang Shen, B. Vršnak, Yuming Wang, D. F. Webb, M. I. Desai, Karin Dissauer, N. Dresing, Mateja Dumbović, Xueshang Feng, Stephan G. Heinemann, M. Laurenza, Noé Lugaz, Bin Zhuang",2021,,https://doi.org/10.1186/s40645-021-00426-7,2.363385
https://openalex.org/W2913231938,Effects of Radiation on the Environment,"Gurpreet Kaur, Jandeep Singh",2019,,https://doi.org/10.1007/978-3-030-05770-1_1,2.3610184
https://openalex.org/W2164046367,Parametric and Threshold Studies of Single Event Sensitivity,E.L. Petersen,2007,,https://doi.org/10.1109/tns.2007.901201,2.358894
https://openalex.org/W2055834713,A GALEX instrument overview and lessons learned,Patrick Morrissey,2006,,https://doi.org/10.1117/12.671839,2.3587599
https://openalex.org/W2784113829,Performance prediction for design of a network of skywave over-the-horizon radars,"David B. Francis, M. A. Cervera, Gordon J. Frazer",2017,,https://doi.org/10.1109/maes.2017.170056,2.3555202
https://openalex.org/W2092601007,Theoretical and experimental aspects of ionospheric structure: A global perspective on dynamics and irregularities,E. P. Szuszczewicz,1986,,https://doi.org/10.1029/rs021i003p00351,2.3518262
https://openalex.org/W2137217762,Ionospheric Induced Scintillation: A Space Weather Enigma,J. J. Sojka,2013,,https://doi.org/10.1002/swe.20041,2.3490677
https://openalex.org/W2080559679,Controlling charge and current neutralization of an ion beam pulse in a background plasma by application of a solenoidal magnetic field: Weak magnetic field limit,"Igor Kaganovich, Edward A. Startsev, A. B. Sefkow, Ronald C. Davidson",2008,,https://doi.org/10.1063/1.3000131,2.3489313
https://openalex.org/W2113453622,The Global Positioning System,"Joseph L. Awange, John Kiema",2013,,https://doi.org/10.1007/978-3-642-34085-7_5,2.3459578
https://openalex.org/W2034364583,The Korean Solar Radio Burst Locator (KSRBL),"Yujiang Dou, Dale E. Gary, Zhiwei Liu, Gelu M. Nita, Su‐Chan Bong, Kyung‐Suk Cho, Young‐Deuk Park, Yong‐Jae Moon",2009,,https://doi.org/10.1086/599624,2.332523
https://openalex.org/W2399916385,Cyber security with radio frequency interferences mitigation study for satellite systems,"Gang Wang, Sixiao Wei, Genshe Chen, Xin Tian, Dan Shen, Khanh Pham, Tien M. Nguyen, Erik Blasch",2016,,https://doi.org/10.1117/12.2224632,2.331816
https://openalex.org/W3006020318,Economic benefit of ensuring uninterrupted water supply during prolonged electricity disruptions – City of Tshwane case study,"J.H. Potgieter, Christian Herold, Marco van Dijk, Jay Bhagwan",2019,,https://doi.org/10.17159/2309-8775/2019/v61n4a2,2.3301687
https://openalex.org/W1988533417,Increasing Radiation Tolerance of Field-Programmable-Gate-Array-Based Computers Through Redundancy and Environmental Awareness,"Jennifer Susan. Hane, Brock J. LaMeres, Todd Kaiser, Raymond J. Weber, Todd Buerkle",2014,,https://doi.org/10.2514/1.i010106,2.3246248
https://openalex.org/W2095439871,On the challenge of a century lifespan satellite,"Jesús Gonzalo, Diego Domínguez, Deibi López",2014,,https://doi.org/10.1016/j.paerosci.2014.05.001,2.3215976
https://openalex.org/W4241410494,The limitations of NEO-uniformitarianism,Duncan Steel,1996,,https://doi.org/10.1007/bf00117530,2.316125
https://openalex.org/W2066103402,Assessing future climate change and energy price scenarios: institutional building investment,"Seth H. Holmes, Christoph Reinhart",2013,,https://doi.org/10.1080/09613218.2013.769297,2.3156147
https://openalex.org/W2887940914,Space Weather Prediction to Enhance the Reliability of the More Electric Aircraft,"Jingnan Guo, Giampaolo Buticchi, Chris Gerada",2018,,https://doi.org/10.1109/isie.2018.8433845,2.3147402
https://openalex.org/W2972481122,The Micro Solar Flare Apparatus (MiSolFA) instrument concept,"Erica Lastufka, D. Casadei, G. J. Hurford, Matej Kuhar, Gabriele Torre, Säm Krucker",2020,,https://doi.org/10.1016/j.asr.2019.08.040,2.312797
https://openalex.org/W2163823553,Radiation Hardened Coarse-Grain Reconfigurable Architecture for Space Applications,"S. Baloch, Tughrul Arslan, Adrian Stoica",2007,,https://doi.org/10.1109/ipdps.2007.370379,2.3111522
https://openalex.org/W1681301770,Donald Menzel and the Creation of the Sacramento Peak Observatory,Ruth P. Liebowitz,2002,,https://doi.org/10.1177/002182860203300207,2.3090534
