id,title,authors,publication_year,journal,doi,relevance_score
https://openalex.org/W2504704957,Internal Transport Barrier Broadening through Subdominant Mode Stabilization in Reversed Field Pinch Plasmas,"R. Lorenzini, F. Auriemma, A. Fassina, E. Martines, D. Terranova, F. Sattin",2016,,https://doi.org/10.1103/physrevlett.116.185002,4.275461
https://openalex.org/W2107928900,"High-Spatial-Resolution Imaging Combining High-Order Adaptive Optics, Frame Selection, and Speckle Masking Reconstruction","C. Denker, Dulce Mascarinas, Yan Xu, Wenda Cao, Guo Yang, Haimin Wang, Philip R. Goode, Thomas Rimmelé",2005,,https://doi.org/10.1007/s11207-005-1108-4,4.2731814
https://openalex.org/W2610632796,Moving forward in circles: challenges and opportunities in modelling population cycles,"Frédéric Barraquand, Stilianos Louca, Karen C. Abbott, Christina A. Cobbold, Flora Cordoleani, Donald L. DeAngelis, Bret D. Elderd, Jeremy W. Fox, Priscilla E. Greenwood, Frank M. Hilker, Dennis L. Murray, Christopher R. Stieha, Rachel A. Taylor, Kelsey Vitense, Gail S. K. Wolkowicz, Richard V. Tyson",2017,,https://doi.org/10.1111/ele.12789,4.2730346
https://openalex.org/W1986572224,Theory of electric fields in the auroral acceleration region,David J. Tetreault,1991,,https://doi.org/10.1029/90ja02324,4.268157
https://openalex.org/W2022784870,High Performance Dependable Multiprocessor II,"Javier Ramos, J.R. Samson, D. Lupia, Ian A. Troxel, Rajagopal Subramaniyan, Adam Jacobs, Alan D. George, Grzegorz Cieslewski, John Curreri, Mike Fischer, Eric Grobelny, Alan D. George, Vikas A. Aggarwal, Minesh Patel, R. Some",2007,,https://doi.org/10.1109/aero.2007.353106,4.263333
https://openalex.org/W2082721927,Continuum Self-Organized-Criticality Model of Turbulent Heat Transport in Tokamaks,"V. Tangri, Amita Das, P. K. Kaw, R. Singh",2003,,https://doi.org/10.1103/physrevlett.91.025001,4.249784
https://openalex.org/W3100811744,Power laws and self-organized criticality in theory and nature,"Dimitrije Marković, Claudius Gros",2014,,https://doi.org/10.1016/j.physrep.2013.11.002,4.2491083
https://openalex.org/W1574833683,,Yuri E. Litvinenko,2002,,https://doi.org/10.1023/a:1014231124805,4.248689
https://openalex.org/W2915791330,Space settlement: What's the Rush?,James S.J. Schwartz,2019,,https://doi.org/10.1016/j.futures.2019.02.013,4.2438974
https://openalex.org/W2033391585,Solar Weather Event Modelling and Prediction,"M. Messerotti, F. Zuccarello, S. L. Guglielmino, V. Bothmer, Jean Lilensten, G. Noci, M. Storini, H. Lundstedt",2009,,https://doi.org/10.1007/s11214-009-9574-x,4.2411504
https://openalex.org/W2904880930,Potential role of senescence in radiation-induced damage of the aged skeleton,"Abhishek Chandra, Sean S. Park, Robert J. Pignolo",2019,,https://doi.org/10.1016/j.bone.2018.12.006,4.2399983
https://openalex.org/W2014920520,Relating white light and in situ observations of coronal mass ejections: A review,A. P. Rouillard,2011,,https://doi.org/10.1016/j.jastp.2010.08.015,4.2323136
https://openalex.org/W2069052203,A long‐term investigation of the HF communication channel over middle‐ and high‐latitude paths,"John M. Goodman, J. William O. Ballard, E. Sharp",1997,,https://doi.org/10.1029/97rs01194,4.231997
https://openalex.org/W2159022784,Shock Propagation Model version 2 and its application in predicting the arrivals at Earth of interplanetary shocks during Solar Cycle 23,"Xinhua Zhao, Xueshang Feng",2014,,https://doi.org/10.1002/2012ja018503,4.226627
https://openalex.org/W2064485497,Generative models for similarity-based classification,"Luca Cazzanti, Maya R. Gupta, Anjali J. Koppal",2008,,https://doi.org/10.1016/j.patcog.2008.01.005,4.2243423
https://openalex.org/W2107609666,Vulnerability of cities to extreme space weather events: A new frontier of a multidisciplinary urban research,Yosef Jabareen,2012,,https://doi.org/10.4236/ns.2012.46051,4.2195787
https://openalex.org/W2009234973,Operational Impact of Statistical Properties of Single Event Phenomena for On-Orbit Measurements and Predictions Improvement,"Guillaume Hubert, Robert Ecoffet",2013,,https://doi.org/10.1109/tns.2013.2281144,4.21643
https://openalex.org/W2558495935,On-Orbit Upset Rate Prediction at Advanced Technology Nodes: a 28 nm FD-SOI Case Study,"Victor Malherbe, Gilles Gasiot, Dimitri Soussan, Jean‐Luc Autran, Philippe Roché",2017,,https://doi.org/10.1109/tns.2016.2634604,4.214258
https://openalex.org/W2886493055,Low-frequency Radio Transients on the Active M-dwarf EQ Peg and the Search for Coronal Mass Ejections,"M. K. Crosley, Rachel A. Osten",2018,,https://doi.org/10.3847/1538-4357/aacf02,4.2116833
https://openalex.org/W2161491269,Single event effect flight data analysis of multiple NASA spacecraft and experiments; implications to spacecraft electrical designs,"C.M. Seidleck, Kenneth A. LaBel, A.K. Moran, Michele Gates, J.L. Barth, E. G. Stassinopoulos, T. Gruner",2002,,https://doi.org/10.1109/radecs.1995.509840,4.2032843
https://openalex.org/W2083260866,Soft error benchmarking of L2 caches with PARMA,"Jinwoo Suh, Mehrtash Manoochehri, Murali Annavaram, Michel Dubois",2011,,https://doi.org/10.1145/1993744.1993755,4.200518
https://openalex.org/W2059497919,New developments in SOLAR2000 for space research and operations,"W. Kent Tobiska, S. Dave Bouwer",2006,,https://doi.org/10.1016/j.asr.2005.08.015,4.1993213
https://openalex.org/W4245749738,Jam today,C. Evans-Pughe,2011,,https://doi.org/10.1049/et.2011.0413,4.197946
https://openalex.org/W3101041965,EUV SpectroPhotometer (ESP) in Extreme Ultraviolet Variability Experiment (EVE): Algorithms and Calibrations,"L. V. Didkovsky, D. L. Judge, Seth Wieman, T. N. Woods, Andrew Jones",2009,,https://doi.org/10.1007/s11207-009-9485-8,4.1945214
https://openalex.org/W3168448056,The Solar Activity Monitor Network – SAMNet,"R. Erdélyi, M. B. Korsós, Xin Huang, Yang Yong, Danielle Pizzey, Steven Wrathmall, Ifan G. Hughes, M. Dyer, V. S. Dhillon, B. Belucz, R. Brajša, Piyali Chatterjee, Xuewu Cheng, Yuanyong Deng, S. Vargas Domínguez, R. Joya, P. Gömöry, N. Gyenge, A. Hanslmeier, A. Kučera, D. W. Longcope, Fengzhen Li, Zaihua Liu, Long Xu, M. Mathioudakis, S. A. Matthews, R. T. James McAteer, Alexei Pevtsov, W. Pötzi, P. Romano, Jinhua Shen, J. Temesvary, A. Tlatov, C. Triana, D. Utz, Astrid Veronig, Yu Wang, Yihua Yan, T. V. Zaqarashvili, F. Zuccarello",2022,,https://doi.org/10.1051/swsc/2021025,4.1918516
https://openalex.org/W2788982596,Extreme Value Analysis of Solar Flare Events,"Thomai Tsiftsi, V. De la Luz",2018,,https://doi.org/10.1029/2018sw001958,4.1903677
https://openalex.org/W1969324423,Cooling out the radiation damage on the XMM-Newton EPIC MOS CCDs,"A. F. Abbey, P. J. Bennie, Martin Turner, B. Altieri, S. Rives",2003,,https://doi.org/10.1016/j.nima.2003.08.018,4.19031
https://openalex.org/W4234301118,Geomagnetic Disturbances: Their Impact on the Power Grid,,2013,,https://doi.org/10.1109/mpe.2013.2256651,4.1857142
https://openalex.org/W1562302503,,Yuri E. Litvinenko,1999,,https://doi.org/10.1023/a:1005168814515,4.171813
https://openalex.org/W2187587298,Heavy Ion Single Event Effects Measurements of 512Mb ISSI SDRAM,"F. Irom, Mehran Amrbar",2015,,https://doi.org/10.1109/redw.2015.7336713,4.1661286
https://openalex.org/W4289257365,Solar effects on communications,,1992,,https://doi.org/10.1109/61.127038,4.1558986
https://openalex.org/W2038904922,The impact of solar flares and magnetic storms on humans,Jo Ann Joselyn,1992,,https://doi.org/10.1029/91eo00062,4.1558886
https://openalex.org/W2052495933,Smyer H-chondrite impact-melt breccia and evidence for sulfur vaporization,Alan E. Rubin,2002,,https://doi.org/10.1016/s0016-7037(01)00799-2,4.150034
https://openalex.org/W2003919997,Simple Diversity Combining Techniques for Cyclostationarity Detection Based Spectrum Sensing in Cognitive Radio Networks,Shusuke Narieda,2014,,https://doi.org/10.1109/vtcspring.2014.7023095,4.1352243
https://openalex.org/W2001705908,Photobiological uncertainties in the Archaean and post-Archaean world,Charles S. Cockell,2002,,https://doi.org/10.1017/s1473550402001003,4.1226254
https://openalex.org/W2099526106,"Future-Proofing the State: Managing Risks, Responding to Crises and Building Resilience","Allan Fels, John Wanna, Jonathan Boston, Pierre-Alain Schieb",2014,,https://doi.org/10.22459/fps.05.2014,4.1190124
https://openalex.org/W2090000121,Normal and unusual transient events in IRAC images,"B. M. Patten, Joseph L. Hora, G. G. Fazio, P. Barmby, Zhong Wang, David Makovoz",2004,,https://doi.org/10.1117/12.550543,4.1114664
https://openalex.org/W2897473609,New Capabilities for Prediction of High‐Latitude Ionospheric Scintillation: A Novel Approach With Machine Learning,"Ryan McGranaghan, A. J. Mannucci, Brian Wilson, C. A. Mattmann, R. Chadwick",2018,,https://doi.org/10.1029/2018sw002018,4.1091046
https://openalex.org/W2327920832,Future role of vitamin C in radiation mitigation and its possible applications in manned deep space missions: Survival study and the measurement of cell viability,"Seyed Mohammad Javad Mortazavi, Sedigheh Sharifzadeh, Hossein Mozdarani, Maryam Foadi, M Haghani, E. Sabet",2014,,https://doi.org/10.1016/j.ejmp.2014.07.278,4.101719
https://openalex.org/W2099476593,Performance of the SciBar cosmic ray telescope (SciCRT) toward the detection of high-energy solar neutrons in solar cycle 24,"Yoshinori Sasai, Yuya Nagai, Y. Itow, Y. Matsubara, T. Sako, D. López, T. Itow, K. Munakata, C. Kato, M. Kozai, Tetsuya Miyazaki, S. Shibata, A. Oshima, Hiroshi Kojima, H. Tsuchiya, K. Watanabe, Tatsumi Koi, M. Urban, Luís González, E. Ortiz, O. Musalém, A. Hurtado, R. García, M. Anzorena",2014,,https://doi.org/10.1186/1880-5981-66-130,4.0879183
https://openalex.org/W2935333082,"Performance analysis of quiet and disturbed time ionospheric TEC responses from GPS-based observations, IGS-GIM, IRI-2016 and SPIM/IRI-Plas 2017 models over the low latitude Indian region","Kanaka Durga Reddybattula, Sampad Kumar Panda",2019,,https://doi.org/10.1016/j.asr.2019.03.034,4.0873733
https://openalex.org/W2221558203,Anticipating uncertainty: The security of European critical outer space infrastructures,Phillip A. Slann,2016,,https://doi.org/10.1016/j.spacepol.2015.12.001,4.061752
https://openalex.org/W2009005433,Operational radiation protection for astronauts and cosmonauts and correlated activities of ESA Medical Operations,"U. Straube, Thomas Berger, G. Reitz, R. Facius, C. Fuglesang, Thomas Reiter, Volker Damann, Michel Tognini",2010,,https://doi.org/10.1016/j.actaastro.2009.10.004,4.056984
https://openalex.org/W1958364902,System hardening approaches for a LEO satellite with radiation tolerant parts,"G.K. Lum, nicholas bennett, J. M. Lockhart",1997,,https://doi.org/10.1109/23.658985,4.0511217
https://openalex.org/W2145565162,A High-Rate JPEG2000 Compression System for Space,Damon Van Buren,2005,,https://doi.org/10.1109/aero.2005.1559540,4.048767
https://openalex.org/W2097188530,Scattering of solar energetic electrons in interplanetary space,"C. Vocks, G. Mann",2009,,https://doi.org/10.1051/0004-6361/200911738,4.046937
https://openalex.org/W3083954384,"The Dark Target Algorithm for Observing the Global Aerosol System: Past, Present, and Future","L. A. Remer, R. C. Levy, S. Mattoo, D. Tanré, Pawan Gupta, Yingxi Shi, Virginia Sawyer, L. A. Munchak, Yaping Zhou, Mijin Kim, Charles Ichoku, Falguni Patadia, Rongrong Li, Santiago Gassó, R. G. Kleidman, B. N. Holben",2020,,https://doi.org/10.3390/rs12182900,4.0451894
https://openalex.org/W2176060079,Dynamic reconfiguration for management of radiation-induced faults in FPGAs,"Maya Gokhale, Paul Graham, Michael Wirthlin, D. Eric Johnson, Nathaniel Rollins",2006,,https://doi.org/10.1504/ijes.2006.010162,4.0447035
https://openalex.org/W2745330750,Non-neutralized Electric Currents in Solar Active Regions and Flare Productivity,"Ioannis Kontogiannis, Manolis K. Georgoulis, Sung‐Hong Park, Jordan A. Guerra",2017,,https://doi.org/10.1007/s11207-017-1185-1,4.037645
https://openalex.org/W3191940437,PSTEP: project for solar–terrestrial environment prediction,"K. Kusano, Kiyoshi Ichimoto, Mamoru Ishii, Yoshizumi Miyoshi, Shigeo Yoden, Hideharu Akiyoshi, Ayumi Asai, Yusuke Ebihara, Hitoshi Fujiwara, Tada‐nori Goto, Yoichiro Hanaoka, Hisashi Hayakawa, Keisuke Hosokawa, Hideyuki Hotta, Kornyanat Hozumi, Shinsuke Imada, Kazumasa Iwai, T. Iyemori, Hidekatsu Jin, Ryuho Kataoka, Yuto Katoh, Takashi Kikuchi, Yûki Kubo, Satoshi Kurita, Haruhisa Matsumoto, Takefumi Mitani, Hiroko Miyahara, Yasunobu Miyoshi, Tsutomu Nagatsuma, Aoi Nakamizo, Satoko Nakamura, Hiroyuki Nakata, Naoto Nishizuka, Y. Otsuka, Shinji Saito, Susumu Saito, Takashi Sakurai, Tatsuhiko Sato, Toshifumi Shimizu, Hiroyuki Shinagawa, K. Shiokawa, Daikou Shiota, Takeshi Takashima, Chihiro Tao, Shin Toriumi, S. Ueno, K. Watanabe, Shinichi Watari, S. Yashiro, Kohei Yoshida, Akimasa Yoshikawa",2021,,https://doi.org/10.1186/s40623-021-01486-1,4.0361085
https://openalex.org/W2093412576,The Cibola Flight Experiment,"Heather Quinn, D. Roussel-Dupré, M. Caffrey, Paul Graham, Michael Wirthlin, Keith Morgan, Anthony Salazar, Tony Nelson, Will Howes, Eric K. Johnson, Jon Johnson, Brian Pratt, Nathan Rollins, Jim Krone",2015,,https://doi.org/10.1145/2629556,4.034744
https://openalex.org/W2286585054,A Study of Feature Selection of Magnetogram Complexity Features in an Imbalanced Solar Flare Prediction Data-Set,"Amani Al-Ghraibah, Laura E. Boucheron, R. T. James McAteer",2015,,https://doi.org/10.1109/icdmw.2015.188,4.029297
https://openalex.org/W1991289689,The ionospheric impact of the October 2003 storm event on Wide Area Augmentation System,"A. Komjáthy, L. Sparks, A. J. Mannucci, A. J. Coster",2005,,https://doi.org/10.1007/s10291-004-0126-2,4.027563
https://openalex.org/W3003481615,Survey of Soft Error Mitigation Techniques Applied to LEON3 Soft Processors on SRAM-Based FPGAs,"Server Kasap, Eduardo Wachter, Xiaojun Zhai, Shoaib Ehsan, Klaus D. McDonald-Maier",2020,,https://doi.org/10.1109/access.2020.2969714,4.023604
https://openalex.org/W2136993737,WAAS measurement processing; current design and potential improvements,"Karl Shallberg, Sheng Fang",2008,,https://doi.org/10.1109/plans.2008.4570014,4.020182
https://openalex.org/W2163180702,Impact of Spacecraft Shielding on Direct Ionization Soft Error Rates for Sub-130 nm Technologies,"Jonathan A. Pellish, M.A. Xapsos, C. Stauffer, Thomas Jordan, Anthony B. Sanders, Ray Ladbury, Timothy R. Oldham, Paul W. Marshall, David F. Heidel, Kenneth P. Rodbell",2010,,https://doi.org/10.1109/tns.2010.2084595,4.016334
https://openalex.org/W3021693647,Spectral Properties and Physical Extent of Pyroclastic Deposits on Mercury: Variability Within Selected Deposits and Implications for Explosive Volcanism,"S. Besse, A. Doressoundiram, Océane Barraud, Léa Griton, Thomas Cornet, Claudio Muñoz, Indhu Varatharajan, J. Helbert",2020,,https://doi.org/10.1029/2018je005879,4.0077505
https://openalex.org/W1933130265,Kinetic modelling of runaway electron avalanches in tokamak plasmas,"Emelie Nilsson, J. Decker, Y. Peysson, R. Granetz, F. Saint‐Laurent, M. Vlainic",2015,,https://doi.org/10.1088/0741-3335/57/9/095006,4.0036864
https://openalex.org/W2616696377,Increasing crew autonomy for long duration exploration missions: Self-scheduling,"Jessica J. Márquez, Steven Hillenius, Bob Kanefsky, Jimin Zheng, Ivonne Deliz, M. Reagan",2017,,https://doi.org/10.1109/aero.2017.7943838,4.0032215
https://openalex.org/W2119780596,"Use of Satellite Technologies for Power System Measurements, Command, and Control","Keith E. Holbert, Gerald Heydt, Hui Ni",2005,,https://doi.org/10.1109/jproc.2005.846334,4.001681
https://openalex.org/W2054916370,The Healing Touch: Tools and Challenges for Smart Grid Restoration,"Shanshan Liu, Yunhe Hou, Chen‐Ching Liu, Robin Podmore",2014,,https://doi.org/10.1109/mpe.2013.2285609,3.9937932
https://openalex.org/W2801614151,Prediction of Solar Eruptions Using Filament Metadata,"Ashna Aggarwal, Nicole Schanche, Katharine K. Reeves, Dustin Kempton, Rafal A. Angryk",2018,,https://doi.org/10.3847/1538-4365/aab77f,3.9925294
https://openalex.org/W2039140503,Highlights of the “Space Weather Risks and Society” Workshop,"Stephanie R. Langhoff, T. Straume",2012,,https://doi.org/10.1029/2012sw000792,3.9863143
https://openalex.org/W2031632671,Descriptive study of solar activity sudden increase and Halloween storms of 2003,Ahmed A. Hady,2009,,https://doi.org/10.1016/j.jastp.2008.11.019,3.981849
https://openalex.org/W2023988983,"Multisegmented, multilayer-coated mirrors for the Solar Ultraviolet Imager","D. Martínez-Galarce, Régina Soufli, David L. Windt, M. E. Bruner, Eric M. Gullikson, Shayna Khatri, Eberhard Spiller, Jeff C. Robinson, Sherry L. Baker, Evan Prast",2013,,https://doi.org/10.1117/1.oe.52.9.095102,3.9818466
https://openalex.org/W2532886082,"Energetic particles in laboratory, space and astrophysical plasmas","K. G. McClements, Mikhail Turnyanskiy",2016,,https://doi.org/10.1088/0741-3335/59/1/014012,3.9754562
https://openalex.org/W2020492952,Plasma Conditions During the Galaxy 15 Anomaly and the Possibility of ESD from Subsurface Charging,"Dale C. Ferguson, W. F. Denig, J. V. Rodriguez",2011,,https://doi.org/10.2514/6.2011-1061,3.9731874
https://openalex.org/W3114940703,Big Data and Actuarial Science,"Hossein Hassani, Stephan Unger, Christina Beneki",2020,,https://doi.org/10.3390/bdcc4040040,3.9646432
https://openalex.org/W2041039823,Satellite test of radiation impact on Ramtron 512K FRAM,"Todd C. MacLeod, W. H. Sims, Kosta Varnavas, Rana Sayyah, Fat D. Ho",2009,,https://doi.org/10.1109/nvmt.2009.5429778,3.9555182
https://openalex.org/W2803490876,The Response of African Equatorial/Low‐Latitude Ionosphere to 2015 St. Patrick's Day Geomagnetic Storm,"Paul O Amaechi, E.O. Oyeyemi, A.O. Akala",2018,,https://doi.org/10.1029/2017sw001751,3.9524968
https://openalex.org/W2071024095,Cataractogenic potential of ionizing radiations in animal models that simulate man,"J.T. Lett, A.B. Cox, A. C. Lee",1986,,https://doi.org/10.1016/0273-1177(86)90305-4,3.9431038
https://openalex.org/W2039176752,The design of integrated monitoring systems to provide early indications of environmental/ecological changes,R. E. Munn,1988,,https://doi.org/10.1007/bf00394670,3.9397802
https://openalex.org/W4391421565,"Simultaneous X-ray and optical variability of M dwarfs observed with
  eROSITA and TESS","W. M. Joseph, B. Stelzer, E. Magaudda, T. Vičánek Martínez",2024,,https://doi.org/10.48550/arxiv.2401.17287,3.936137
https://openalex.org/W2321885835,Survey of Weather Impact Models used in Air Traffic Management,James Krozel,2010,,https://doi.org/10.2514/6.2010-9020,3.9337099
https://openalex.org/W2162113102,MAGNETIC RECONNECTION AS THE CAUSE OF COSMIC RAY EXCESS FROM THE HELIOSPHERIC TAIL,"A. Lazarian, P. Desiati",2010,,https://doi.org/10.1088/0004-637x/722/1/188,3.9256601
https://openalex.org/W3034447365,The Value of CME Arrival Time Forecasts for Space Weather Mitigation,"M. J. Owens, M. Lockwood, Luke Barnard",2020,,https://doi.org/10.1029/2020sw002507,3.9218652
https://openalex.org/W3121631677,Predicting Solar Flares Using SDO/HMI Vector Magnetic Data Products and the Random Forest Algorithm,"Chang Liu, Na Deng, Jason T. L. Wang, Haimin Wang",2017,,https://doi.org/10.3847/1538-4357/aa789b,3.9207454
https://openalex.org/W4233639559,The hazards of space travel,R. B. Setlow,2003,,https://doi.org/10.1038/sj.embor.embor7400016,3.9131665
https://openalex.org/W2027684355,Controlling Self-Organizing Dynamics on Networks Using Models that Self-Organize,"Pierre‐André Noël, Charles D. Brummitt, Raissa M. D’Souza",2013,,https://doi.org/10.1103/physrevlett.111.078701,3.9024298
https://openalex.org/W2969911446,Medical considerations for a return to the Moon,"Ryan A Anderton, Bonnie N Posselt, Matthieu Komorowski, Peter D. Hodkinson",2019,,https://doi.org/10.1093/occmed/kqz099,3.8873057
https://openalex.org/W2782426147,"Effects of space weather on the ionosphere and LEO satellites’ orbital trajectory in equatorial, low and middle latitude","Victor U. J. Nwankwo, Sandip K. Chakrabarti",2018,,https://doi.org/10.1016/j.asr.2017.12.034,3.8861313
https://openalex.org/W4237596989,Huge Data Sets and the Frontiers of Computational Feasibility,Edward J. Wegman,1995,,https://doi.org/10.2307/1390857,3.8840997
https://openalex.org/W2090965745,Dynamics of the Earth’s Particle Radiation Environment,"Rami Vainio, L. Desorgher, D. Heynderickx, M. Storini, E. O. Flückiger, R. B. Horne, G. A. Kovaltsov, K. Kudela, M. Laurenza, S. McKenna‐Lawlor, Hanna Rothkaehl, Ilya Usoskin",2009,,https://doi.org/10.1007/s11214-009-9496-7,3.8828392
https://openalex.org/W3099265117,THREE YEARS OF <i>FERMI</i> GBM EARTH OCCULTATION MONITORING: OBSERVATIONS OF HARD X-RAY/SOFT GAMMA-RAY SOURCES,"C. Wilson‐Hodge, G. Case, M. L. Cherry, J. Rodi, A. Camero-Arranz, Peter Jenke, V. Chaplin, E. Beklen, Mark H. Finger, Narayan Bhat, Michael Briggs, V. Connaughton, J. Greiner, R. M. Kippen, C. Meegan, W. S. Pačiesas, R. D. Preece, A. von Kienlin",2012,,https://doi.org/10.1088/0067-0049/201/2/33,3.8810089
https://openalex.org/W1969419280,Gravity Probe B data analysis status and potential for improved accuracy of scientific results,"C. W. F. Everitt, M.J. Adams, W. Bencze, Saps Buchman, Bruce Clarke, John Conklin, Daniel B. DeBra, M. Dolphin, M. Heifetz, David Hipkins, Y. Hernández Jiménez, D. Keitel, J. Kolodziejczak, J Li, J. M. Lockhart, B. Muhlfelder, Bradford W. Parkinson, Mark Salomon, A. S. Silbergleit, V. Solomonik, Kristina Ståhl, J. P. Turneaure, P. Worden",2008,,https://doi.org/10.1088/0264-9381/25/11/114002,3.8793442
https://openalex.org/W2747451145,An abridged history of federal involvement in space weather forecasting,"Becaja M. Caldwell, Eoin D. McCarron, Seth Jonas",2017,,https://doi.org/10.1002/2017sw001626,3.8787858
https://openalex.org/W4248580820,,"Ian S. Murray, Martin Beech, M. J. Taylor, Peter Jenniskens, R. L. Hawkes",1998,,https://doi.org/10.1023/a:1017003019448,3.8777792
https://openalex.org/W2158834060,"Progress and issues in understanding the physics of ELM dynamics, ELM mitigation, and ELM control",N. Oyama,2008,,https://doi.org/10.1088/1742-6596/123/1/012002,3.876318
https://openalex.org/W3089701360,Prototypic Lightweight Alloy Design for Stellar‐Radiation Environments,"Matheus A. Tunes, Lukas Stemper, Graeme Greaves, Peter J. Uggowitzer, Stefan Pogatscher",2020,,https://doi.org/10.1002/advs.202002397,3.8643591
https://openalex.org/W1976563590,Plans for the first balloon flight of the gamma-ray polarimeter experiment (GRAPE),"M. McConnell, Christopher M. Bancroft, Peter F. Bloser, Taylor Connor, Colin Frost, Jason Legere, S. Longworth, Gerard B. Pape, J. M. Ryan",2010,,https://doi.org/10.1117/12.857467,3.8622634
https://openalex.org/W2475646144,Availability analysis for satellite data processing systems based on SRAM FPGAs,"Felix Siegle, Tanya Vladimirova, Jørgen Ilstad, O. Emam",2016,,https://doi.org/10.1109/taes.2016.140914,3.8530495
https://openalex.org/W2005160486,EVA dosimetry in manned spacecraft,I. Thomson,1999,,https://doi.org/10.1016/s0027-5107(99)00131-1,3.8530178
https://openalex.org/W2054499895,Earthquake prediction: 20 years of global experiment,V. G. Kossobokov,2012,,https://doi.org/10.1007/s11069-012-0198-1,3.8503892
https://openalex.org/W2162376317,A framework for integration of IVHM technologies for intelligent integration for vehicle management,"Deidre E. Paris, Luis Trevino, Mick Watson",2005,,https://doi.org/10.1109/aero.2005.1559691,3.8392007
https://openalex.org/W4313021159,The Mechanism of Signal Processing of Solar Radio Burst Data in E-CALLISTO Network (Malaysia),"Zety Sharizat Hamidi, N.N.M. Shariff",2014,,https://doi.org/10.56431/p-fu36s5,3.839055
https://openalex.org/W3099781560,Observational artifacts of Nuclear Spectroscopic Telescope Array: ghost rays and stray light,"Kristin K. Madsen, Finn E. Christensen, William W. Craig, Karl W. Forster, Brian W. Grefenstette, Fiona A. Harrison, H. Miyasaka, Vikram Rana",2017,,https://doi.org/10.1117/1.jatis.3.4.044003,3.8326843
https://openalex.org/W1939765617,Spaceflight experiences and lessons learned with NASA's first fiber optic data bus,"Kenneth A. LaBel, Mark C. Flanegan, Paul W. Marshall, C.J. Dale, E. G. Stassinopoulos",2002,,https://doi.org/10.1109/radecs.1993.316537,3.8295865
https://openalex.org/W2079434727,Hardware simulator of Caliste-SO detectors for STIX instrument,"P. Pоdgórski, D. Ścisłowski, Mirosław Kowaliński, Tomasz Mrozek, M. Stęślicki, J. Barylak, A. Barylak, J. Sylwester, Säm Krucker, G. J. Hurford, Nicolas Arnold, P. Orleański, A. Meuris, O. Limousin, O. Gevin, O. Grimm, L. Etesi, N. Hochmuth, M. Battaglia, A. Csillaghy, I. W. Kienreich, Astrid Veronig, S. Bloomfield, Mary Byrne, Anna Maria Massone, Michele Piana, S. Giordano, Konrad Skup, Rafał Graczyk, Małgorzata Michalska, W. Nowosielski, Andrzej Cichocki, M. Mosdorf",2013,,https://doi.org/10.1117/12.2035285,3.8276243
https://openalex.org/W2923375788,Should All Cars Be Electric by 2025? The Electric Car Debate in Europe,"Nathalie Ortar, Marianne Ryghaug",2019,,https://doi.org/10.3390/su11071868,3.8220968
https://openalex.org/W2050361934,"The transcension hypothesis: Sufficiently advanced civilizations invariably leave our universe, and implications for METI and SETI",John M. Smart,2012,,https://doi.org/10.1016/j.actaastro.2011.11.006,3.819431
https://openalex.org/W2149873291,Characteristics of magnetoacoustic sausage modes,"Andrew Inglis, Tom Van Doorsselaere, C. S. Brady, V. M. Nakariakov",2009,,https://doi.org/10.1051/0004-6361/200912088,3.8148868
