id,title,authors,publication_year,journal,doi,relevance_score
https://openalex.org/W4317734948,Investigating Dynamical Complexity and Fractal Characteristics of Bitcoin/US Dollar and Euro/US Dollar Exchange Rates around the COVID-19 Outbreak,"Pavlos I. Zitis, Shinji Kakinaka, Ken Umeno, M. P. Hanias, Stavros G. Stavrinides, Stelios M. Potirakis",2023,,https://doi.org/10.3390/e25020214,1.4405413
https://openalex.org/W2044423335,A geomagnetic activity forecast for improving the efficiency of aeromagnetic surveys in Greenland,"J. Watermann, Hans Gleisner, Thorkild M. Rasmussen",2011,,https://doi.org/10.1016/j.asr.2010.02.005,1.4401237
https://openalex.org/W2548090944,Mass-Loss Evolution in the EUV Low Corona from SDO/AIA Data,"F. M. López, M. Hebe Cremades, F. A. Nuevo, L. Balmaceda, A. M. Vásquez",2016,,https://doi.org/10.1007/s11207-016-1031-x,1.438991
https://openalex.org/W3127944214,"Reflections on COVID-19, Insurance, Business Interruption, Systemic Risk, and the Future",Robert H. Jerry,2021,,https://doi.org/10.14422/icade.i110.y2020.007,1.4376662
https://openalex.org/W2626032527,Formation flying and position determination for a space-based interferometer in GEO graveyard orbit,"Jeffrey Stuart, Angela Dorsey, Farah Alibay, Nuno Filipe",2017,,https://doi.org/10.1109/aero.2017.7943705,1.4370031
https://openalex.org/W2090169830,&lt;title&gt;Review of reliability and quality assurance issues for space optics systems&lt;/title&gt;,Vicki R. Farmer,1993,,https://doi.org/10.1117/12.138941,1.4343185
https://openalex.org/W2910957249,Measurement of Astronomical Seeing Using Long Exposure Solar Images,"Sridharan Rengaswamy, B. Ravindra, K. Prabhu",2019,,https://doi.org/10.1007/s11207-019-1393-y,1.4331326
https://openalex.org/W2289563242,Definition of Capabilities Needed for a Single Event Effects Test Facility,"Bernie Riemer, Franz X. Gallmeier",2014,,https://doi.org/10.2172/1185723,1.4313681
https://openalex.org/W3174112643,Blind restoration of solar images via the Channel Sharing Spatio-temporal Network,"Shuai Wang, Qingqing Chen, Chunyuan He, Chi Zhang, Libo Zhong, Hua Bao, Changhui Rao",2021,,https://doi.org/10.1051/0004-6361/202140376,1.4309793
https://openalex.org/W3122132868,A Valuation Framework for Informing Grid Modernization Decisions: Summary,"Larry C. Markel, Stanton W. Hadley, Patrick O’Connor, Amy K. Wolfe",2019,,https://doi.org/10.2172/1760154,1.4308113
https://openalex.org/W2428557393,The Ground Simulation of Spacecraft Discharge Impacts on the Space Environment Detectors,"Jinlong Wang, Zhenlong Zhang",2016,,https://doi.org/10.1109/tps.2016.2574945,1.428874
https://openalex.org/W2995258929,Radio and X-Ray Diagnostics of Energy Release in Solar Flares,Bin Chen,2017,,https://doi.org/10.18130/v3t226,1.4286034
https://openalex.org/W2605216516,Biological Control of Pest and Vector Insects,Vonnie D. C. Shields,2017,,https://doi.org/10.5772/63274,1.4249718
https://openalex.org/W2161243499,The PAC2MAN mission: a new tool to understand and predict solar energetic events,"Jorge Amaya, Sophie Musset, Viktor Andersson, A. Diercke, Christian Höller, Sergiu Iliev, Lilla Juhász, René Kiefer, Riccardo Lasagni Manghi, Solène Lejosne, Mohammad Madi, Mirko Rummelhagen, Markus Scheucher, A. M. Sorba, S. Thonhofer",2015,,https://doi.org/10.1051/swsc/2015005,1.4233576
https://openalex.org/W2605973305,Understanding Space Weather: Part II: The Violent Sun,"K. T. Strong, J. T. Schmelz, J. L. R. Saba, T. A. Kucera",2017,,https://doi.org/10.1175/bams-d-16-0191.1,1.4227852
https://openalex.org/W1974142467,Methods for reducing RF interference for improved NQR detection of landmines,"Kathryn J. Long, Robert M. Deas, Darren K. Riley, Michael J. Gaskell",2003,,https://doi.org/10.1117/12.486051,1.4198332
https://openalex.org/W1996032576,Spectral Formation in Compact X-Ray Sources,Richard McCray,1984,,https://doi.org/10.1088/0031-8949/1984/t7/017,1.4195439
https://openalex.org/W2305374927,Review on space weather in Latin America. 1. The beginning from space science research,"C. M. Denardini, S. Dasso, A. González-Esparza",2016,,https://doi.org/10.1016/j.asr.2016.03.012,1.4132333
https://openalex.org/W2735146484,"Synoptic Ozone, Cloud Reflectivity, and Erythemal Irradiance from Sunrise to Sunset for the Whole Earth as viewed by the DSCOVR spacecraft from Lagrange-1","J. R. Herman, Liang Huang, J. R. Herman, J. R. Ziemke, Alexander Cede, Karin Blank",2017,,https://doi.org/10.5194/amt-2017-155,1.4117193
https://openalex.org/W2316139672,Structural Design of Frame-Membrane Habitat Concepts Considering Life Support Requirements for Lunar Colonization,"Ramesh B. Malla, Kevin M. Brown, Thomas Filburn",2011,,https://doi.org/10.2514/6.2011-5114,1.4093848
https://openalex.org/W2346814257,Science outreach and capacity building in geomagnetism and space sciences-An Indian Institute of Geomagnetism endeavor,"Praveen B. Gawali, Ankush Bhaskar, Ajay Dhar, D. S. Ramesh",2016,,https://doi.org/10.1002/2015sw001326,1.4088356
https://openalex.org/W2610591413,"Millisecond, microsecond, nanosecond: What can we do with more precise time?","Edmund O. Schweitzer, David Whitehead, Greg Zweigle, V. Skendžić, Shankar V. Achanta",2016,,https://doi.org/10.1109/cpre.2016.7914898,1.4078375
https://openalex.org/W2767285739,"NUCLEAR THEORY DEGREE ZERO, WITH TWO CHEERS FOR DERRIDA","Drew Milne, John Kinsella",2017,,https://doi.org/10.1080/0969725x.2017.1387358,1.4062945
https://openalex.org/W1975574742,Approximated trial and error analysis in scientific databases,"Etzard Stolte, Gustavo Alonso",2003,,https://doi.org/10.1016/s0306-4379(02)00052-2,1.4051226
https://openalex.org/W4237170090,New Zealand's dark sky reserve,,2012,,https://doi.org/10.1111/j.1468-4004.2012.53404_11.x,1.4010222
https://openalex.org/W2482955757,"Research Platforms That Reduce the Acceleration Experienced in the Experimental Frame of Reference: Achieving ""Microgravity""",James Patton Downey,2001,,https://doi.org/10.1021/bk-2001-0793.ch002,1.3999703
https://openalex.org/W1928571026,Issues and concerns in using composites for spacecraft structures,"S.K. Nagesh, S.V.K. Shastry, V.K. Harijaran, Kattim VR",2003,,https://doi.org/10.1109/icemic.2002.1006470,1.3973922
https://openalex.org/W4243624558,News,,2006,,https://doi.org/10.1049/et:20060912,1.3944418
https://openalex.org/W4386360854,Regular Solar Radio Imaging at Arecibo: Space Weather Perspective of Evolution of Active Regions,"P. K. Manoharan, Christopher J. Salter, C. G. M. Brum, S. M. White, Phil Perillat, Alfredo Santoni, Félix G. Fernández, T. Ghosh, B. B. P. Perera, Arun Venkataraman",2023,,https://doi.org/10.3847/25c2cfeb.537ba515,1.3939221
https://openalex.org/W3214633517,Constraining the CME Core Heating and Energy Budget with SOHO/UVCS,"Maurice L. Wilson, J. C. Raymond, S. T. Lepri, R. Lionello, Nicholas A. Murphy, Katharine K. Reeves, Chengcai Shen",2022,,https://doi.org/10.3847/1538-4357/ac4d35,1.3908339
https://openalex.org/W2032021102,The impact of man on climate,Robert G. Fleagle,1979,,https://doi.org/10.1007/bf01060519,1.3899484
https://openalex.org/W2064333204,Design and Evaluation of an Exploration Assistant for Human Deep Space Risk Mitigation,"Donald Platt, Patrick Millot, Guy André Boy",2013,,https://doi.org/10.3182/20130811-5-us-2037.00037,1.3838011
https://openalex.org/W4244364585,Environmental Hazards,Ilan Kelman,2017,,https://doi.org/10.1002/9781118786352.wbieg0550,1.3805014
https://openalex.org/W2735730551,Anomalous behavior of the ionosphere before strong earthquakes,"P. Peddi Naidu, T. Madhavi Latha, D. N. Madhusudhana Rao, M. Devi",2017,,https://doi.org/10.1007/s12648-017-1066-3,1.3796973
https://openalex.org/W4242322226,Beam-powered lunar rover design,"Jeff Dagle, E.P. Coomes, Z.I. Antoniak, Judith Ann Bamberger, J.M. Bates, Mao-Cheng Chiu, Richard E. Dodge, James A. Wise",1992,,https://doi.org/10.2172/10136607,1.3729347
https://openalex.org/W2965024738,"Untoward laughter and the micropolitical: social action, politics and the will after the sovereign subject",Scott Sharpe,2019,,https://doi.org/10.1177/1474474019866205,1.3723485
https://openalex.org/W2502794569,Radio Receiver Architectures,Joseph J. Carr,2000,,https://doi.org/10.1016/b978-075067319-8/50002-1,1.3712457
https://openalex.org/W2897382346,Reviews and Prospect of International Electromagnetic Seismic Satellite,"Xinping Zhang, Haixiao Zhuang, Guang-zhi Yang, Yufei Liu, Hongzheng Fang, Wei Qin, Yongfu Guo, Ping Yang, Peng Liu, Han Hongbo, Xiangyan Zhang, Xi Chen",2018,,https://doi.org/10.1007/s42423-018-0021-5,1.3710103
https://openalex.org/W1587316607,Radiation in Microgravity,Gregory A. Nelson,1996,,https://doi.org/10.1002/cphy.cp040234,1.3679519
https://openalex.org/W4206805861,The Solar Eruption of 2017 September 10: Wavy with a Chance of Protons,"C. A. de Koning, V. J. Pizzo, Daniel B. Seaton",2022,,https://doi.org/10.3847/1538-4357/ac374d,1.3657119
https://openalex.org/W2273821497,A Test‐of‐Design Rubric for Autonomous Systems,Jack K. Horner,2012,,https://doi.org/10.1002/inst.201215218,1.3591444
https://openalex.org/W2892154105,Diversity Management and Practical Wisdom: Organizational Change Success Factors,Frank Ihlenburg,2018,,https://doi.org/10.1007/978-3-658-23521-5_10,1.3590745
https://openalex.org/W2011927967,Focal plane cameras for ESA optical astronomy missions,"David H. Lumb, N. Rando, A. Peacock, F. Favata, M. A. C. Perryman",2003,,https://doi.org/10.1016/j.nima.2003.08.013,1.3561132
https://openalex.org/W2504872183,X-RAYING THE DARK SIDE OF VENUS—SCATTER FROM VENUS’ MAGNETOTAIL?,"Masoud Afshari, G. Pérès, Patricia R. Jibben, A. Petralia, F. Reale, Mark Weber",2016,,https://doi.org/10.3847/0004-6256/152/4/107,1.3519958
https://openalex.org/W2344735631,American Robins (<i>Turdus migratorius</i>) and Cedar Waxwings (<i>Bombycilla cedrorum</i>) vary in use of cultivated cherry orchards,"Rachael A. Eaton, Catherine A. Lindell, H. Jeffrey Homan, George M. Linz, Brian A. Maurer",2016,,https://doi.org/10.1676/wils-128-01-97-107.1,1.3400987
https://openalex.org/W1670699070,Near Earth asteroid rendezvous spacecraft overview,"A. G. Santo, S.C. Lee, A. F. Cheng",2002,,https://doi.org/10.1109/aero.1996.495972,1.3399444
https://openalex.org/W2031444478,Instrument design for the Mars atmospheric and volatile evolution mission,Nicholas M. Jedrich,2012,,https://doi.org/10.1109/aero.2012.6187022,1.338679
https://openalex.org/W1546648414,Requirements for Space Settlement Design,Anita E. Gale,2004,,https://doi.org/10.1063/1.1649674,1.3371508
https://openalex.org/W4241200548,Mars Express Mission Outcome: Scientific and Technological Return of the First European Satellite around the Red Planet,,2004,,https://doi.org/10.2514/6.iac-04-q.3.a.06,1.337039
https://openalex.org/W1982425054,Meeting the challenge to balloon science,W. Vernon Jones,2000,,https://doi.org/10.1016/s0273-1177(00)00054-5,1.3362383
https://openalex.org/W2009944297,6.6.2 Factors Contributing to Space System Failures and Successes,David Kaslow,2003,,https://doi.org/10.1002/j.2334-5837.2003.tb02677.x,1.3360972
https://openalex.org/W4211141748,Lunar-Based Structures,,2009,,https://doi.org/10.2514/5.9781563479878.0179.0204,1.3328565
https://openalex.org/W2324141513,Environmental Management and the Department of the Interior,Stanley A. Cain,1968,,https://doi.org/10.2307/973513,1.3328122
https://openalex.org/W4390948007,Cardiovascular Effects of Cosmic Radiation and Microgravity,"Omar Giacinto, Mario Lusini, Emanuele Sammartini, Alessandro Minati, Ciro Mastroianni, Antonio Nenna, Giuseppe Pascarella, Davide Sammartini, Massimiliano Carassiti, Fabio Miraldi, Massimo Chello, Francesco Pelliccia",2024,,https://doi.org/10.3390/jcm13020520,1.3312148
https://openalex.org/W4392373474,Possible Interrelations of Space Weather and Seismic Activity: An Implication for Short-term Earthquake Prediction,"В. М. Сорокин, В. А. Новиков",2024,,https://doi.org/10.20944/preprints202402.1590.v1,1.3286335
https://openalex.org/W2884065145,The ground effects of severe space weather,"Ciarán Beggan, J. A. Wild, Mark Gibbs",2018,,https://doi.org/10.1093/astrogeo/aty194,1.3263925
https://openalex.org/W2052089817,Mini-conference and related sessions on laboratory plasma astrophysics,"Hantao Ji, Michael Brown, Scott Hsu, Hui Li, R. P. Drake",2004,,https://doi.org/10.1063/1.1687726,1.3248913
https://openalex.org/W2087181805,Execution of the Spitzer in-orbit checkout and science verification plan,"John W. Miles, Sue H. Linick, C. Allan Boyles, Mark Garcia, John B. Gilbert, Stacia Long, M. W. Werner, Robyn Wilson",2004,,https://doi.org/10.1117/12.552330,1.3213178
https://openalex.org/W3168606776,Deep transfer learning for the classification of variable sources,"Dae Won Kim, Doyeob Yeo, Coryn A. L. Bailer‐Jones, Giyoung Lee",2021,,https://doi.org/10.1051/0004-6361/202140369,1.3107431
https://openalex.org/W1998521614,&lt;title&gt;Space environment monitoring mission beyond GOES-M&lt;/title&gt;,"R. N. Grubb, P. L. Bornmann, G. Heckman, T. G. Onsager, H. J. Singer, R. A. Viereck",1996,,https://doi.org/10.1117/12.254080,1.3094003
https://openalex.org/W2164356160,Atmospheric Heating as a Research Tool: Link to Space-Based Solar Power,"B. J. Eastlund, Lyle M. Jenkins",2008,,https://doi.org/10.1109/aero.2008.4526526,1.3039899
https://openalex.org/W4392001201,&lt;strong&gt;&lt;/strong&gt;How Satellite Imaging and Deep Learning Are Influenced by Tensor Decompositions: A Review,Dr Ismail A Mageed,2024,,https://doi.org/10.20944/preprints202402.1122.v1,1.3006232
https://openalex.org/W2111960301,Halloween Storm Simulations with the Space Weather Modeling Framework,"T. I. Gombosi, G. Tóth, И. В. Соколов, W. B. Manchester, A. J. Ridley, I. I. Roussev, D. de Zeeuw, K. C. Hansen, Kenneth G. Powell, Quentin F. Stout",2006,,https://doi.org/10.2514/6.2006-87,1.2994673
https://openalex.org/W2320996617,Overcoming the Hurdles of Incorporating In Situ Resource Utilization (IRSU) into Human Lunar Exploration,"Gerald B. Sanders, T. M. Simon, Benjamin Rosenbaum, W. E. Larson, Jacqueline Quinn, Janine Captain, Dale Boucher",2010,,https://doi.org/10.1061/41096(366)118,1.2950616
https://openalex.org/W2774209776,Hierarchical Bayesian modeling of ionospheric TEC disturbances as non-stationary processes,"Abdu Mohammed Seid, Tesfahun Berhane, Lassi Roininen, Melessew Nigussie",2018,,https://doi.org/10.1016/j.asr.2017.12.009,1.2784592
https://openalex.org/W1989317337,Radiation-Hard Field-Programmable Gate Arrays Configuration Technique Using Silicon on Sapphire,"Kashfia Haque, Paul Beckett",2014,,https://doi.org/10.1109/tvlsi.2013.2242101,1.2778764
https://openalex.org/W4232638772,"Solar-cycle, seasonal, and asymmetric dependencies of thermospheric mass density disturbances due to magnetospheric forcing","Andrés Calabia, Shuanggen Jin",2019,,https://doi.org/10.5194/angeo-2019-78,1.2777915
https://openalex.org/W4361192435,Relativistic Particle Measurements in Jupiter’s Magnetosphere with Pix.PAN,"Johannes Hulsman, X. Wu, P. Azzarello, D. Berge, M. Campbell, G. Clark, F. Cadoux, Tomoya Ilzawa, P. Kollmann, X. Llopart, Quentin Nénon, M. Paniccia, E. Roussos, P. Smolyanskiy, Elisabet Golobardes, Pierre Thonet",2023,,https://doi.org/10.21203/rs.3.rs-2743432/v1,1.2756202
https://openalex.org/W4230089730,"6.1. Space Applications for disaster prevention. warning, mitigation and relief",,1994,,https://doi.org/10.1016/0045-8732(94)90071-x,1.2743363
https://openalex.org/W2052686195,Use of Lunar Outpost for Developing Space Settlement Technologies,Lloyd Purves,2008,,https://doi.org/10.2514/6.2008-7680,1.267106
https://openalex.org/W2148222934,Solar thematic maps for space weather operations,"E. J. Rigler, S. M. Hill, A. A. Reinard, R. A. Steenburgh",2012,,https://doi.org/10.1029/2012sw000780,1.2644424
https://openalex.org/W2531160984,Alphasat Hosted Payloads: Extending Operations for Another 3 years,Philippe Sivac,2016,,https://doi.org/10.2514/6.2016-5723,1.2634437
https://openalex.org/W2323783030,Operational Challenges Presented by the Future Orbit of the Chandra X-Ray Observatory,"W. M. Davis, Sabina Hurley, Brent D. Williams, David Balke",2010,,https://doi.org/10.2514/6.2010-2050,1.2603042
https://openalex.org/W3205033957,A DATA-INTENSIVE APPROACH TO EXPLOIT NEW GNSS SCIENCE OPPORTUNITIES,"Vicente Navarro, Javier Ventura‐Traveset",2021,,https://doi.org/10.4995/cigeo2021.2021.12740,1.2541622
https://openalex.org/W2286528055,The Use of Advanced Silicon CMOS Transistor as Hardness-By-Design Technique to Improve Radiation Tolerance for Integrated Circuits Dedicated to Space Applications,"Leonardo Navarenho de Souza Fino, Rafael Navarenho de Souza",2014,,https://doi.org/10.4271/2014-36-0297,1.2515957
https://openalex.org/W4391482609,3‐D Ionospheric Imaging Over the South American Region With a New TEC‐Based Ionospheric Data Assimilation System (TIDAS‐SA),"Ercha Aa, Shun‐Rong Zhang, P. J. Erickson, Wenbin Wang, A. J. Coster, W. Rideout",2024,,https://doi.org/10.1029/2023sw003792,1.2477123
https://openalex.org/W1929970318,A new approach to outlying data in estimation of vertical total electron content,Ramazan Cüneyt Erenoǧlu,2015,,https://doi.org/10.17559/tv-20141117201942,1.2476275
https://openalex.org/W2053482948,The effect of the prompt particle environment at L2 on optical CCDs for astronomy and astrophysics,"Richard M. Ambrosi, Andrew D. Holland, David R. Smith, Ian B. Hutchinson, M. Denby",2005,,https://doi.org/10.1016/j.pss.2005.10.004,1.2468559
https://openalex.org/W1970370309,New Technologies and Concepts for Low Loss Radiation Hardened DC/DC Converters,Geoffrey A. Marcus,2007,,https://doi.org/10.1109/aero.2007.352641,1.2405236
https://openalex.org/W4366703162,Radiation environment and effect detection based on global navigation constellation,"Qiang Lin, Dongya Wang, Qingxiang Zhang, Shenyi Zhang, Ling Li, Shuai Wang, Tao Jing, Mengsun Yu, Yenan Liu, Chao Tian",2023,,https://doi.org/10.1515/astro-2022-0204,1.2397776
https://openalex.org/W4230641204,Space Mobile Network Concepts for Missions Beyond Low Earth Orbit,"David Israël, Christopher Roberts, Robert M. Morgenstern, Jinshan Gao, Wallace Tai",2018,,https://doi.org/10.2514/6.2018-2423,1.2340193
https://openalex.org/W2055807999,A predictive model for space-based X-ray ccd degradation,"A. Antunes, D. N. Burrows, G. P. Garmire, David H. Lumb, J. A. Nousek",1993,,https://doi.org/10.1007/bf01588352,1.2334534
https://openalex.org/W2126573299,NASA's Solar Dynamics Observatory (SDO): A systems approach to a complex mission,"J. Ruffa, Michael Bay, David K. Ward, Pedro Gonzáles, Lisa Bartusek, W. D. Pesnell",2012,,https://doi.org/10.1109/aero.2012.6187017,1.2253498
https://openalex.org/W4233656097,Risks of space colonization,Marko Kovic,2020,,https://doi.org/10.31235/osf.io/hj4f2,1.2187171
https://openalex.org/W1582034389,Verification and operation of adaptive materials in space.,"Tim R. Dargaville, Julie Chase, Gary D. Jones, Mathias C. Celina",2006,,https://doi.org/10.2172/899377,1.2144892
https://openalex.org/W2897439474,Natural Hazards: Systematic Assessment of Their Contribution to Risk and Their Consequences,"Berg Heinz-Peter, Marina Röewekamp",2018,,https://doi.org/10.5772/intechopen.76503,1.2141163
https://openalex.org/W1994310452,Solar Cell Power Systems for Space Stations,C. L. Gould,1964,,https://doi.org/10.1109/ta.1964.4319663,1.2118927
https://openalex.org/W3082593383,Space travel and exploration,Sir Harrie Massey,1965,,https://doi.org/10.1080/00107516508203120,1.2098682
https://openalex.org/W2765509644,Development of an Ideal Magnetohydrodynamics Flowsolver for High Speed Flow Control,"Ravi Balasubramanian, K. Anandhanarayanan",2017,,https://doi.org/10.1007/s40032-017-0393-7,1.2092805
https://openalex.org/W4293770656,Fractionated Proton Irradiation Does Not Impair Hippocampal-Dependent Short-Term or Spatial Memory in Female Mice,"Pilar Simmons, Christa Corley, Antiño R. Allen",2022,,https://doi.org/10.3390/toxics10090507,1.2082119
https://openalex.org/W4308898846,Automated Detection of coronaL MAss Ejecta origiNs for Space Weather AppliCations (ALMANAC),"Thomas Williams, Huw Morgan",2022,,https://doi.org/10.1029/2022sw003253,1.2064109
https://openalex.org/W2119018933,Collision Avoidance Operations in a Multi-Mission Environment,"M. Bester, Bryce Roberts, Mark Lewis, Jeremy Thorsness, Gregory Picard, S. Frey, Daniel Cosgrove, Jeffrey E. Marchese, Aaron Burgart, William W. Craig",2014,,https://doi.org/10.2514/6.2014-1745,1.2025617
https://openalex.org/W2329757245,Education for Advocacy: The Challenge of Sustaining Societal Support for Space Exploration,"Robert H. Diamond, David C. Pieri",2005,,https://doi.org/10.2514/6.2005-2555,1.2011473
https://openalex.org/W3184704387,Overview of qualification protocol of fiber lasers for space applications,"Sami T. Hendow, Suzzanne E. Falvey, Bruce N. Nelson, Lee Thienel, Thomas Drape",2006,,https://doi.org/10.1117/12.644184,1.2005098
https://openalex.org/W2089285163,Auroral x-ray imaging from high- and low-Earth orbit,David L. McKenzie,1994,,https://doi.org/10.1117/12.155914,1.1871136
https://openalex.org/W4307715790,An Ontology for Prognostic Health Management in Spacecraft Avionics,"Michael Cullen Halvorson, Noah Moyers, I. Dale Thomas",2022,,https://doi.org/10.36001/phmconf.2022.v14i1.3195,1.183254
https://openalex.org/W2036498680,Future use of silicon solar cells in extraterrestrial applications,P. A. Iles,1994,,https://doi.org/10.1002/pip.4670020204,1.1792297
https://openalex.org/W2052033318,Improved data exploitation for DKIST high-resolution solar observations,"K. Reardon, S. J. Berukoff",2014,,https://doi.org/10.1109/bigdata.2014.7004403,1.1789548
https://openalex.org/W2099101356,Monte Carlo simulation of induced radioactive background in gamma-ray detector materials,"P.R. Truscott, H.E. Evans, C. S. Dyer, M. Cosby, P. Knight, C.E. Moss",1998,,https://doi.org/10.1109/23.682657,1.1786668
https://openalex.org/W2898299983,Investigating Sub-Pixel 45-Second Periodic Wobble in SDO/AIA Data from January to August 2012,"Ding Yuan, Wei Liu, R. W. Walsh",2018,,https://doi.org/10.1007/s11207-018-1368-4,1.1780872
https://openalex.org/W2756309743,Private Commercial Space Enterprises and Global Governance System,"Ram S. Jakhu, Joseph N. Pelton",2017,,https://doi.org/10.1007/978-3-319-54364-2_5,1.1759694
https://openalex.org/W1983981202,NASA's life sciences and space radiation biology,"P. C. Rambaut, Arnauld Nicogossian",1984,,https://doi.org/10.1016/0273-1177(84)90252-7,1.1753616
https://openalex.org/W4249985734,Effects of Terrestrial Radiation on Integrated Circuits,Robert Baumann,2007,,https://doi.org/10.1201/9781420017663.ch31,1.1685941
https://openalex.org/W2056239291,The MARENOR Project – Maritime Radio System Performances in the High North,"Beate Kvamstad, Fritz Bekkadal, Knut Grythe, Irene Anite Jensen, J.E. Haakegaard, R. Behlke",2014,,https://doi.org/10.4043/24661-ms,1.1606117
https://openalex.org/W2004608720,&lt;title&gt;CUBIC: x-ray CCD spectroscopy of the diffuse x-ray background&lt;/title&gt;,"D. N. Burrows, Mark A. Skinner, Patrick S. Broos, Mark A. Catalano, Laura Cawley, Eric J. Cocklin, L. Engel, Timothy J. Entingh, G. P. Garmire, Roland Green, Diego Janches, Douglas Kelly, Jeffrey A. Mendenhall, J. A. Nousek, David H. Lumb, Andrew D. Holland, Peter J. Pool",1995,,https://doi.org/10.1117/12.218373,1.160184
https://openalex.org/W1491197265,Probability of data loss between mars tumbleweed rovers,"Tyler Hook, Alan A. Barhorst",2015,,https://doi.org/10.1109/drcn.2015.7149013,1.1508747
https://openalex.org/W2897369012,A concept mission for the Stellar Population and Evolution with Cubesats (SPEC),"Giammarco Cialone, Andrea Gianfermo, A. Di Cecco, Silvia Mari, S. Cassisi, Fabio Santoni, Fabrizio Piergentili",2019,,https://doi.org/10.1016/j.asr.2018.10.012,1.1508746
https://openalex.org/W4283770798,Backscattered Solar Lyman-$\alpha $ Emission as a Tool for the Heliospheric Boundary Exploration,"Igor Baliukin, Jean‐Loup Bertaux, M. Bzowski, V. Izmodenov, R. Lallement, Elena Provornikova, Éric Quémerais",2022,,https://doi.org/10.1007/s11214-022-00913-3,1.1467813
https://openalex.org/W2000924531,Mixed Inertial Navigation Systems For Surface Effect Ships,"C. SANGIOVANNI, J. Moryl",1974,,https://doi.org/10.1002/j.2161-4296.1974.tb01199.x,1.1319898
https://openalex.org/W1673538176,Vulnerability assessment of a space based weapon platform electronics system exposed to a thermonuclear weapon detonation,"Christian Perez, J.O. Johnson",1994,,https://doi.org/10.2172/10159218,1.131001
https://openalex.org/W583858418,Life Sciences: on the Critical Path for Missions of Exploration,"Frank M. Sulzman, Mary M. Connors, Karen K. Gaiser",1988,,https://doi.org/10.4271/881012,1.1197996
https://openalex.org/W4233492967,"Space Weather Quarterly Volume 11, Issue 4, 2014","D. J. Knipp, H. J. Singer, Mandy Luk, Thomas Berger, L. J. Lanzerotti, Xinan Yue, William Schreiner, N. M. Pedatella, Richard A. Anthes, A. J. Mannucci, P. R. Straus, Jann‐Yenq Liu",2014,,https://doi.org/10.1002/swqv11i004,1.117013
https://openalex.org/W2897877801,Operational Conditions and<i>In Situ</i>Resources for Mars Surface Exploration,"Michael Lotto, David M. Klaus, B. M. Hynek",2018,,https://doi.org/10.1089/space.2018.0019,1.1146022
https://openalex.org/W4318147815,Benchmark of Data Preprocessing Methods for Imbalanced Classification,"Radovan Haluska, Jan Brabec, Tomáš Komárek",2022,,https://doi.org/10.1109/bigdata55660.2022.10021118,1.1105161
https://openalex.org/W4247466555,Post irradiation effects (PIE) in integrated circuits (MOS),"C.E. Barnes, D.M. Fleetwood, D.C. Shaw, P.S. Winokur",2002,,https://doi.org/10.1109/radecs.1991.213616,1.1090307
https://openalex.org/W2371592910,New Russia’s basic science,Yu. S. Osipov,2006,,https://doi.org/10.1134/s1019331606050029,1.0978233
